title,author,pub"Diary of an infiltrator  Publication:  Saigon : United States Mission in Vietnam, 1966   Document:  English :  Book   :  Microform         Libraries Worldwide : 1   More Like This:  Advanced options ...   See more details for locating this item","Diary of an infiltrator  Publication:  Saigon : United States Mission in Vietnam, 1966   Document:  English :  Book   :  Microform         Libraries Worldwide : 1   More Like This:  Advanced options ...   See more details for locating this item","Saigon : United States Mission in Vietnam, 1966""Health Improvement in Thu Duc, Vietnam /","Isler, Jerry L., CPT.",1968Senior officer debriefing report : [MG David S. Parker] /,"Parker, David S.","APO San Francisco 96375 : Dept. of the Army, Headquarters, United States Army Vietnam, 1969"Senior officer debriefing report /,"Cunningham, H. S.","[APO San Francisco 96250 : Dept. of the Army, Headquarters, 173d Airborne Brigade, 1970"The Vietnam diaries of Lt. Jay R. Greene.,"Greene, Jay R.; Greene, Jay R.",1966-1968"The Volney F. Warner papers, 1981-1983.","Warner, Volney F.",1981-1983"British G.I. in Vietnam, illustrated and with maps.","Kemp, Ian.","London : Robert Hale, 1969""The John H. Hay papers, 1981.","Hay, John H. 1917-",1981Our great spring victory : an account of the liberation of South Vietnam /,"Van-Tien-Dung, 1917 - 2002.; Spragens, John,","New York : Monthly Review Press, 1977""We the people : a participatory history of American life, 1900-1945 /","Lyon, Arthur.; Ledger, Helen., and others","Fullerton : California State University, Fullerton, Oral History Program, 1978""Completion of tour report : [Willard A. Holbrook, III] /","Holbrook, W. A.","APO San Francisco 96205 : Headquarters, Civil Operations and Rural Development Support, Phu Yen Province, II Corps & Military Region 2, MACV Advisory Team 28, 1972"Senior officer debriefing report /,"Chamberlain, Edwin W.","APO 96215 : Headquarters, Advisory Team 50 (44th Special Tactical Zone), Delta Regional Assistance Command, 1973""Interiew, 1985.","Taylor, Hyde.; Patterson, Brad.",1985Five women I love : Bob Hope's Vietnam story /,"Hope, Bob, 1903-2003.","New York : Avon Books, a division of the Hearst Corporation, 1967"Debriefing report /,"Lollis, Shelton E.","APO San Francisco 96307 : Dept. of the Army, Headquarters, 1st Logistical Command, Office of the Commanding General, 1967""Vietnam war letters of Edwin G. ""Jerry"" Shank, air force captain of Winamac, Indiana, 1963-1964.","Shank, Edwin G.",1963-1964Debriefing report : [Ellis W. Williamson].,"Williamson, Ellis W.","APO San Francisco 96225 : Headquarters, 25th Infantry Division, 1969"Composite report of MTT SVN visit with Father Hoa / [by W.A. Lawrence].,"Lawrence, William A.","[FPO San Francisco : Hq., FMFPAC, 1962"Doublecrossed : the Vietnamese revolution /,"Truong, Nhu Tang.; Tomoda, Seki,","[S.l. : s.n., 1970s""Aces and aerial victories : the United States Air Force in Southeast Asia, victories, 1965-1973 /","Futrell, Robert Frank.; Eastman, James N., and others","[Maxwell Air Force Base, Ala.] : Air University, Albert F. Simpson Historical Research Center : for sale by the Supt. of Docs., U.S. Govt. Print. Off., 1976"Deputy province senior advisor completion of tour report /,"Dukkony, Stephen J.","APO 96215 : Headquarters, Advisory Team 92, Go Cong Province, 1973""Oral history of Lt. Jack Rittichier's Vietnam rescue missions, 1968, 1968.","Rittichier, Jack C. 1933-1968.",1968Jones E. Bolt oral history interview. 1984.,"Bolt, Jones E., 1921-; McCoy, Frederic E.",1984"Debriefing report : Lieutenant General James W. Sutherland, Jr., Commanding General, XXIV Corps.","Sutherland, James W. 1918-","[APO San Francisco? : s.n., 1971""Debriefing report : Lieutenant General James W. Sutherland, Jr., Commanding General, XXIV Corps.","Sutherland, James W. 1918-","[APO San Francisco? : s.n., 1971""Interview, 1985.","Johnson, Mike.; Van Orman, Dixie.",1985Senior officer debriefing report : [C.M. Hall /,"Hall, C. M.","APO San Francisco 96350 : Dept. of the Army, Headquarters, I Field Force Vietnam Artillery, 1970"Senior officer debriefing report /,"Zais, Melvin, 1916-1981.","APO San Francisco 96349 : Dept. of the Army, Headquarters, XXIV Corps, Office of the Commanding General, 1970"Senior officer's debriefing report : [MG Melvin Zais].,"Zais, Melvin, 1916-1981.","APO San Francisco 96383 : Headquarters, 101st Airborne Division, Office of the Commanding General, 1969"Senior officer debriefing report : [H.D. Smith].,"Smith, H. D.","APO San Francisco 96349 : Dept. of the Army, Headquarters, U.S. Army Support Command, Da Nang, 1970"Journal of a plague year /,"Parrish, John Anthony.","[London] : Deutsch,  1979, 1972""Actions taken by the 1st Brigade, 4th Infantry Division to thwart the threat directed toward Duc Co, Republic of Vietnam, 23 August-18 September 1967 /","Quinn, Robert J., CPT.",1968"In the house of our friends : typescript, 1982? /","Berry, John Stevens, 1938-",1982"In the house of our friends : typescript, 1982? /","Berry, John Stevens, 1938-",1982"In the house of our friends : typescript, 1982? /","Berry, John Stevens, 1938-",1982"Concept of operation, 1st Logistical Command : debriefing report /","Eifler, Charles W.","[Vietnam? : s.n.], 1967"Dispatches /,"Herr, Michael, 1940-","New York : Avon, 1978""Operation of ""A"" troop, 3rd Squadron, 4th Cavalry Regiment, 25th United States Infantry Division, with district forces of Cu Chi, in a cordone and search on 18 May 1967 in Clay-Trom (Phuoc-My) Hamlet Cu Chi District, Hau Nghia Province, Vietnam : By CPT Thomas E. Addison.","Addison, Thomas E., CPT.",1968"Debrief report - Deputy Senior Advisor, II Corps Tactical Zone (Brigadier General John W. Barnes).","Barnes, John W.","APO San Francisco 96318 : Headquarters, US Army Advisory Group, II Corps Tactical Zone, 1968"Senior officer debriefing report : [LTG Charles A. Corcoran /,"Corcoran, Charles A. 1914-","APO San Francisco 96350 : Dept. of the Army, Headquarters, I Field Force Vietnam, 1970"Senior officer debriefing report of B.G. James F. Hamlet.,"Hamlet, James F.","APO San Francisco 96490 : Dept. of the Army, Headquarters, 3d Brigade (Separate), 1st Cavalry Division (Airmobile), 1972""Interview, 1985.","Bell, Peter.; Milanzi, Peter.",1985Deputy Province Senior Advisor completion of tour report /,"Fitzpatrick, William F.","Phong Dinh Province, APO 96215 : Headquarters, CORDS Advisory Team 56, 1973"Brennan's War : Vietnam 1965-69 /,"Brennan, Matthew, 1946-","Novato, CA : Presidio Press, 1985""Interview, 1985.","Bell, Peter.; Milanzi, Peter.",1985Deputy Province Senior Advisor completion of tour report /,"Fitzpatrick, William F.","Phong Dinh Province, APO 96215 : Headquarters, CORDS Advisory Team 56, 1973"Brennan's War : Vietnam 1965-69 /,"Brennan, Matthew, 1946-","Novato, CA : Presidio Press, 1985""Debriefing report for Brigadier General Henry R. Del Mar, U.S.A. commanding general, United States Army Support Command, Cam Ranh Bay.","Del Mar, Henry R.","[Vietnam? : s.n., 1970"Senior advisor's debrief report : debrief report /,"Cortez, James J.","APO San Francisco 96349 : Headquarters, First Regional Assistance Command, 1st Armor Brigade Advisory Detachment, 1973"Debriefings of Vietnam returnees : debrief of MG Ellis W. Williamson.,"Williamson, Ellis W.","[Fort Belvoir, Va.] : United States Army Combat Developments Command, 1970""Robert B. Bouder collection, circa 1970-1972.","Bouder, Robert B., 1949-1990.",1970-1972The last day /,"Pilger, John.","[London, Mirror Group Newspapers Ltd., 1975"Debrief report /,"Beck, William J.","APO San Francisco 96307 : Dept. of the Army, Headquarters, 4th Psychological Operations Group, 1968"The last day /,"Pilger, John.","New York : Random House,  1976, 1975""Debriefing report, DSA, II CTZ : [BG J.S. Timothy].","Timothy, J. S.","APO San Francisco 96318 : Dept. of the Army, Headquarters, U.S. Army Advisory Group, II Corps tactical Zone, 1969""The Stanley G. Larsen papers, 1976.","Larsen, Stanley R. 1915-",1976End of tour debriefing report : [W.B. Rosson].,"Rosson, William B. 1918-","FPO San Francisco 96602 : United States Marine Corps, Headquarters, III Marine Amphibious Force, Military Assistance Command, Vietnam, 1968""AFRIS province senior advisor completion of tour report, LTC John L. Keefe, Jr. /","Keefe, John L., Jr.","APO 96215 : Headquarters, Advisory Team 64 (Chau Doc Province), Delta Regional Assistance Command, 1973"Province senior advisor completion of tour report : Athol M. Smith /,"Smith, Athol M.","[APO San Francisco 96215] : Headquarters, Advisory Team 84 (Kien Phong Province), Delta Regional Assistance Command, 1973""Senior officer debriefing report : LTC Robert W. Lockridge, Jr., province senior advisor, Long An Province, MR-3, RVN, 21 May 1971-20 February 1973.","Lockridge, Robert W.","[Vietnam? : s.n.], 1973"Interview of Lt. Gen. Walter T. Galligan /,"Galligan, Walter T., 1925-; Hasdorff, James Curtis,","[Washington, D.C. : United States Air Force Historical Research Center : Office of Air Force History Headquarters, USAF, 1983"Wartime memories /,"Childers, Lloyd F., 1921-; Beaman, Charles L.","Fullerton, Calif. : Oral History Program, California State University, Fullerton, 1976""Debriefing report : Major General Delk M. Oden, Chief Army Section, MAAG-Vietnam, 1 June 1963-15 May 1964 ; Commanding General, US Army Support Command, Vietnam, 1 July 1964-1 April 1965 /","Oden, Delk M.","[APO San Francisco?] : US Army, Support Command Vietnam, 1965""Debrief report : [DeWitt C. Armstrong, III, Brigadier General, USA] /","Armstrong, DeWitt C.","[Vietnam? : s.n.], 1971"Winter soldier investigation testimony.  Publication:   1971   Document:  English :  Book      Libraries Worldwide : 1   More Like This:  Advanced options ...   See more details for locating this item,Winter soldier investigation testimony.  Publication:   1971   Document:  English :  Book      Libraries Worldwide : 1   More Like This:  Advanced options ...   See more details for locating this item,1971Brothers : black soldiers in the Nam /,"Goff, Stanley.; Sanders, Robert.; Smith, Clark,","New York : Berkley Books,  1985, 1982""Final report : [Major General Verne L. Bowers, Deputy Chief of Staff, Personnel and Administration, Headquarters, US Army, Vietnam] /","Bowers, Verne L.","[Vietnam? : s.n.], 1970"Province advisor's completion of tour report : [John D. Smith].,"Smith, John D.","[APO San Francisco? : s.n., 1972"Everything we had : an oral history of the Vietnam War /,"Santoli, Al,","[ Taipei : Huang Chia Book Co , 1981"Daedalus' maze revisited; a study of military acculturation and rules transference.,"Spivey, Bruce Mayo.","Chicago, 1974   Dissertation:  Thesis (M.A. in speech and theatre)--University of Illinois at Chicago Circle.""Interview and responses to questions, 1985.","Christy, Howard Allen.; Duff, Murray.; Hillam, Ray C.",1985Senior officer debriefing program : [Gus S. Peters].,"Peters, Gus S.","[APO San Francisco 96227] : Headquarters, U.S. Army Advisory Group, III CTZ, U.S. Military Assistance Command, Vietnam, 1968"Vietnam veterans project /,"Orr, Charles L.; Lowry, Michael.",1983The way he lived; the story of Nguyen-van Tri.,"Phan, Thi Quyn.; Tran, Dinh Van.","Colombo [Ceylon] Afro-Asian Writers Bureau, 1965""Recollections, Vietnam veterans tell their story : to the Americans who were used in that war, to the Indochinese who fought back, to our brothers who died, to our children in the hope that our real stories will help stop future wars of aggression.  Publication:  [Chicago, Ill. : Vietnam Veterans Against the War, 1979   Document:  English :  Book      Libraries Worldwide : 1   More Like This:  Advanced options ...   See more details for locating this item","Recollections, Vietnam veterans tell their story : to the Americans who were used in that war, to the Indochinese who fought back, to our brothers who died, to our children in the hope that our real stories will help stop future wars of aggression.  Publication:  [Chicago, Ill. : Vietnam Veterans Against the War, 1979   Document:  English :  Book      Libraries Worldwide : 1   More Like This:  Advanced options ...   See more details for locating this item","[Chicago, Ill. : Vietnam Veterans Against the War, 1979""Debriefing of senior officers, Maj Gen Charles Duke CG, 18th Engineer Brigade, Vietnam, 10 August 67-14 May 68 /","Duke, Charles M.","[Vietnam? : s.n.], 1968"Debriefing report /,"Bergner, John.","APO San Francisco 96309 : Dept. of the Army, Headquarters, 34th General Support Group (AM & S), 1970"Vietnam journal /,"Currey, Richard, 1949-","Cambridge, Mass. : Apple-wood Press, 1980""Thomas P. Lynch papers, 1982.","Lynch, Thomas P., 1927-",1982"Senior officers debriefing report : [Lieutenant General A.S. Collins, Jr. /","Collins, A. S., Jr.","APO San Francisco 96350 : Dept. of the Army, Headquarters, I Field Force Vietnam, 1971"Veterans project /,"Hoffman, James F., 1943-; Voitus, Dale John.",1982Veterans project /,"Callaway, Larry Wayne, 1940-; Voitus, Dale John.",1982"""A return to human nature.""  Publication:  [Saigon, 1968   Document:  English :  Book      Libraries Worldwide : 1   More Like This:  Advanced options ...   See more details for locating this item","""A return to human nature.""  Publication:  [Saigon, 1968   Document:  English :  Book      Libraries Worldwide : 1   More Like This:  Advanced options ...   See more details for locating this item","[Saigon, 1968"End of tour debriefing report : [Robert R. Williams].,"Williams, Robert R.","APO San Francisco 96384 : Dept. of the Army, Headquarters, 1st Aviation Brigade, 1969"Veterans project /,"Callaway, Larry Wayne, 1940-; Voitus, Dale John.",1982"""A return to human nature.""  Publication:  [Saigon, 1968   Document:  English :  Book      Libraries Worldwide : 1   More Like This:  Advanced options ...   See more details for locating this item","""A return to human nature.""  Publication:  [Saigon, 1968   Document:  English :  Book      Libraries Worldwide : 1   More Like This:  Advanced options ...   See more details for locating this item","[Saigon, 1968"End of tour debriefing report : [Robert R. Williams].,"Williams, Robert R.","APO San Francisco 96384 : Dept. of the Army, Headquarters, 1st Aviation Brigade, 1969"Senior officer debriefing program /,"Eckhardt, G. S.","APO 96215 : Headquarters, Delta Military Assistance Command, USAAG, IV CTZ, 1969"Debrief report /,"Caruthers, L. H.","[Vietnam? : s.n.], 1968"Debriefing report /,"Timmes, Charles J.","[Vietnam? : s.n.], 1964"Southeast Asian immigrant project /,"Nguyen, Dan.; Arirachakaran, Poncharas.",1981"Out of rice, ammunition and bandages : notes of a VC veteran.",Ha Xuan Dai.,"Saigon : United States Mission in Vietnam, 1968""Interview, 1985.","Nay, Earl.; Turner, Timothy M.",1985"Down on the 99th,","Mitchell, James R.","Maxwell Air Force Base, Ala., Air War College, Air University, 1973"Don't tread on my tire rubber sandals : a tale of Vietnam /,"Beatty, David L.","New York : Seven Oceans Book, 1969"Move out : and other verse /,"Carr, George Joseph, 1945-1967.; Carr, L. J.","New Berlin, Wis. : L.J. Carr,  1968, 1968"[Frank Korbl manuscript collection] 1965-2002.,"Korbl, Frank.",1965-2002Senior officer debriefing report : [COL Wallace H. Nutting] /,"Nutting, Wallace H.","APO San Francisco 96257 : Dept. of the Army, Headquarters, 11th Armored Cavalry Regiment, 1961"Tail wind : a true story /,"Van Buskirk, Robert.; Bauer, Fred.","Dallas, TX : Acclaimed Books, 1983"YSU veterans project,"Longacre, David H., 1931-; Shaffer, Emmett C.",1974P.O.W.: two years with Vietcong [by] George E. Smith. With an introd. and epilogue by Donald Duncan.,"Smith, George Edward, 1938-",Berkeley Ramparts Press 1971Senior officer debriefing report : [MG O.M. Barsanti] /,"Barsanti, O. M.","APO San Francisco 96383 : Dept. of the Army, 101st Air Cavalry Division, 1968"My Vietnam experiences /,"McKinney, John B.",1970s"Letters of Captain John P. Barker, 1967-1968.","Jaeger, Edward P., 1942-",1968-1969Senior officer debriefing report /,"Joy, D. Duncan.","APO SF 96357 : Headquarters, Advisory Team 68 (Vinh Long Province), Delta Regional Assistance Command, 1971""Eric K. Shinseki collection, 1985-2003 (bulk 1997-2003).","Shinseki, Eric K.",1985-2003AFRIS - province advisor completion of tour report ... Col. Robert L. Burgess ...,"Burgess, Robert L.","APO 96215 : Office of the Province Advisor, Kien Tuong Province, MR-4 CORDS Advisory Team 85, 1973"AFRIS province advisor completion of tour report : [Arthur D. Moreland] /,"Moreland, Arthur D.","APO San Francisco 96215 : Headquarters, Advisory Team 55, Delta Regional Assistance Command, 1972""Diary of an infiltrator : background.  Publication:  Saigon : United States Mission in Vietnam, 1967   Document:  English :  Book      Libraries Worldwide : 1   More Like This:  Advanced options ...   See more details for locating this item","Diary of an infiltrator : background.  Publication:  Saigon : United States Mission in Vietnam, 1967   Document:  English :  Book      Libraries Worldwide : 1   More Like This:  Advanced options ...   See more details for locating this item","Saigon : United States Mission in Vietnam, 1967""Interview, 1985.","Watkins, Pat.; James, Criss.",1985Senior officer debriefing report : MG H.C. Schrader.,"Schrader, H. C.","APO San Francisco 96377 : Dept. of the Army, Headquarters, 18th Engineer Brigade, 1971""Letter from John Steinbeck, 1-[8].","Steinbeck, John, 1902-1968.","St. Louis : National Student Committee for Victory in Vietnam, 1967""William J. McCaffrey papers, 1967-1997.","McCaffrey, William J., 1914-",1967-1997Deputy Province Senior Advisor completion of tour report /,"Kobata, K.","APO 96215 : Headquarters, CORDS/Advisory Team 20, Bac Lieu Province, 1973"Debriefing format : [BG James W. Gunn] /,"Gunn, James W.","[Vietnam? : s.n.], 1969"Debriefing of officers returning from field assignments : [Hal D. McCown] /,"McCown, Hal D.","APO San Francisco 96375 : Dept. of the Army, Headquarters, U.S. Army Vietnam, 1963"Debriefing of Colonel George C. Morton /,"Morton, George C.","APO 40, San Francisco, Calif. : Headquarters, U.S. Army Special Forces (Provisional) Vietnam, 1963""Interview, 1985.","Shuler, Brigham.; Burnett, Scott S.",1985"Interview, 1985.","Fernstedt, Ronald Roy.; Burnett, Stan.",1985Debriefing report : [Col. W.F. Williams /,"Williams, W. F.","APO San Francisco 96371 : Dept. of the Army, Headquarters, 3d Brigade, 9th Infantry Division, 1970""Mephis, Nam, Sweden.","Whitmore, Terry.","Garden City, NY: Doubleday., 1971"When the hurlyburly's done /,"Byrd, Barthy.","1981 Dissertation:  Thesis (M.A.)--New Mexico State University, 1981."My day in the barrel /,"Dotson, Robert S.","Maxwell Air Force Base, Ala. : Air University, 1978""Robert V. Hubbard papers, 30 Aug 1962-11 Oct 1963, 10 Apr 1968, undated.","Hubbard, Robert V.; Clement, Joe M.; Hill, Don., and others",1962-1968"Robert V. Hubbard papers, 30 Aug 1962-11 Oct 1963, 10 Apr 1968, undated.","Hubbard, Robert V.; Clement, Joe M.; Hill, Don., and others",1962-1968"Operations of the 3rd Battalion, 3rd Marines, 3rd Marine Division, in a search and destroy mission on 9 December 1966 in Quang Tri Province, Republic of Vietnam : By CPT John H. Admire.","Admire, John H., CPT.",1966"Letters, 1966-1967.","Doolen, Clarence E.",1966-1967"Debriefing report, Major General Marshall B. Garth, Commanding General, Third Regional Assistance Command : 4 October 1972-28 March 1973.","Garth, Marshall B.","[S.l. : s.n., 1973"Silence was a weapon : the Vietnam war in the villages /,"Herrington, Stuart A., 1941-","New York : Ivy Press, 1982""Robert R. Ploger papers, 1978.","Ploger, Robert R. 1915-",1978"Debriefings of Vietnam returnees : command summary.  Publication:  [Fort Belvoir, Va.] : United States Army Combat Developments Command, 1970   Document:  English :  Book      Libraries Worldwide : 1   More Like This:  Advanced options ...   See more details for locating this item","Debriefings of Vietnam returnees : command summary.  Publication:  [Fort Belvoir, Va.] : United States Army Combat Developments Command, 1970   Document:  English :  Book      Libraries Worldwide : 1   More Like This:  Advanced options ...   See more details for locating this item","[Fort Belvoir, Va.] : United States Army Combat Developments Command, 1970""Debriefings of Vietnam returnees : command summary.  Publication:  [Fort Belvoir, Va.] : United States Army Combat Developments Command, 1969   Document:  English :  Book      Libraries Worldwide : 1   More Like This:  Advanced options ...   See more details for locating this item","Debriefings of Vietnam returnees : command summary.  Publication:  [Fort Belvoir, Va.] : United States Army Combat Developments Command, 1969   Document:  English :  Book      Libraries Worldwide : 1   More Like This:  Advanced options ...   See more details for locating this item","[Fort Belvoir, Va.] : United States Army Combat Developments Command, 1969""Debriefings of Vietnam returnees : command summary.  Publication:  [Fort Belvoir, Va.] : United States Army Combat Developments Command, 1968   Document:  English :  Book      Libraries Worldwide : 1   More Like This:  Advanced options ...   See more details for locating this item","Debriefings of Vietnam returnees : command summary.  Publication:  [Fort Belvoir, Va.] : United States Army Combat Developments Command, 1968   Document:  English :  Book      Libraries Worldwide : 1   More Like This:  Advanced options ...   See more details for locating this item","[Fort Belvoir, Va.] : United States Army Combat Developments Command, 1968""Debriefings of Vietnam returnees : command summary.  Publication:  [Fort Belvoir, Va.] : United States Army Combat Developments Command, 1971   Document:  English :  Book      Libraries Worldwide : 1   More Like This:  Advanced options ...   See more details for locating this item","Debriefings of Vietnam returnees : command summary.  Publication:  [Fort Belvoir, Va.] : United States Army Combat Developments Command, 1971   Document:  English :  Book      Libraries Worldwide : 1   More Like This:  Advanced options ...   See more details for locating this item","[Fort Belvoir, Va.] : United States Army Combat Developments Command, 1971"A rumor of war.,"Caputo, Philip.","London : Arrow Books,  1978, 1977""Senior officer debriefing report, Colonel (P) E.F. Gudgel, Jr.","Gudget, E. F. Jr.","[APO San Francisco 96266 : Dept. of the Army, Headquarters, II Field Force Vietnam Artillery, 1971"Debriefing report on insurgency in the Mekong River Delta of Vietnam /,"Connor, John P.","[Vietnam? : s.n.], 1964"The flotsam of war and peace a study of the Vietnam veteran in American society /,"Fleming, Robert Howard.","1979 Dissertation:  Thesis (Ed. D.)--Boston University, 1979."Senior officer debriefing program /,"Matheson, S. H.","APO San Francisco 96222 : Headquarters, United States Military Assistance Command, Vietnam (Forward), Office of the Assistant Chief of Staff, J3, 1968"In touch /,"Steinbeck, John, 1946-","[New York] : Dell, 1970"In touch.,"Steinbeck, John, 1946-","New York, Dell,  1968, 1969"In touch /,"Steinbeck, John.","New York : Dell Publishing Co. Inc, 1969"Senior officer debriefing report : [Hal B. Jennings].,"Jennings, Hal B., 1915-","APO San Francisco 96375 : Dept. of the Army, Headquarters, U.S. Army Vietnam, 1969"On foreign grounds portraits of Americans in Vietnam /,"Heiss, Andrea.","1983 Dissertation:  Thesis (Ph. D.)--University of Iowa, 1983.""Interview, 1985.","Warr, Wayne A.; Fellows, Scott M.",1985Debrief report /,"Koster, S. W.","APO San Francisco 96374 : Dept. of the Army, Headquarters, Americal Division, 1968""Vietnam, first time /","Nagorski, Zygmunt, 1912-2011.","Croton-on-Hudson, N.Y. : Hudson Institute, 1969"Senior officer debriefing program /,"Kinnard, Lee Douglas.","APO San Francisco 96266 : Headquarters, II Field Force Vietnam Artillery, 1969"Nam : the Vietnam War in the words of the men and women who fought there /,"Baker, Mark, 1950-","London : Abacus,  1982, 1987"Nam : the Vietnam war in the words of the men and women who fought there.,"Baker, Mark, 1950-","London : Abacus, 1981"Nam : the Vietman War in the words of the men and women who fought there /,"Baker, Mark, 1950-","New York : Morrow, 1981"Nam : the Vietnam War in the words of the men and women who fought there /,"Baker, Mark.","London : Abacus, 1983"Nam : the Vietnam war in the words of the men and women who fought there /,"Baker, Mark, 1950-","New York : Cooper, 2001., 1981"A very special open letter : an American speaks from the grave /,"Shank, Edwin Gerald,","[West Palm Beach, Fla.] : Council for Statehood,  1963-1964""Senior officer debriefing report : Lieutenant General W.J. McCaffrey, Deputy Commanding General, United States Army, Vietnam.","McCaffrey, W. J.","APO San Francisco 96375 : Dept. of the Army, Headquarters, U.S. Army Vietnam, 1972"Senior officer debriefing report /,"Hill, John G.","Camp Red Devil, APO San Francisco 96477 : Dept. of the Army, HQ, 1st Infantry Brigade, 5th Infantry Division (Mech), 1971"Those gallant men : on trial in Vietnam /,"Berry, John Stevens, 1938-","Novato, Calif. : Presidio, 1983""In the presence of mine enemies, 1965-1973 : a prisoner of war /","Rutledge, Howard.; Rutledge, Phyllis.; White, Lyla., and others","Old Tappan, N.J. : Guideposts, Inc., 1973""Effectiveness of Mao Tse Tung's theory of ""dissension in the enemy homeland"" with regards to the Vietnam War /","Todd, Richard A.","Fort Benning, GA. : Staff Department, The Infantry School, 1974"[Interview with Paul D. Harkins /,"Harkins, Paul D. 1904-1984.; Gittinger, Ted.",1983"Defense of Landing Zone 10 Alfa by Task Force Tyson, 28-29 May 1966, during Operation Paul Revere I, II Corps Tactical Zone, Republic of Vietnam /","Bisantz, Anthony, CPT.",1966