title,author,pubSoon the war is ending! /,"Vanderbreggen, Cornelius, 1915-","Hiawassee, Ga. : Reapers Fellowship, 1985""I'll ride the lightning when I go : destination, Vietnam /","Collins, Margaret Grahame.; Gould, Ed.","Victoria, B.C. : Cappis Press, 1982"Here comes Charlie /,"Lollis, Charles W., 1934-1968.; Lollis, Janice.","Perry, Ga. : Crossroads Productions and Publications, 1978"Human dignity under attack : the political and military socialization of Vietnam veterans /,"Reiff, John David.","1982 Dissertation:  Thesis (Ph. D.)--University of Michigan, 1982."Stocktaking for the seventies.,"Burchett, Wilfred G., 1911-1983.","[Melbourne?, 1970"Black sheep three /,"Taylor, John T.",1969-1984?Our great spring victory : an account of the liberation of South Vietnam /,"Van Tien D~ung.; Spragens, John.","New York : Monthly Review Press, 1977"A Soldier reports,"Westmoreland, William Childs (1914-2005). Auteur.","Garden City (N.Y.) : Doubleday, 1976"A soldier reports /,"Westmoreland, William C.","Garden City, N.Y., 1976"When hell was in session /,"Denton, Jeremiah A.; Brandt, Ed.","Clover, SC : Commission Press, 1976"Beyond combat,"Hutchens, James M.","New York, Pyramid Books 1970""On the line /  Publication:  Jacksonville, Fla. : F.F. Hughes & Associates, 1981   Document:  English :  Book      Libraries Worldwide : 4   More Like This:  Advanced options ...   See more details for locating this item","On the line /  Publication:  Jacksonville, Fla. : F.F. Hughes & Associates, 1981   Document:  English :  Book      Libraries Worldwide : 4   More Like This:  Advanced options ...   See more details for locating this item","Jacksonville, Fla. : F.F. Hughes & Associates, 1981"Veteran's Day /,"Kane, Rod.","[Washington, D.C.?] : Combat Bachelor Productions, 1985""Life.  Publication:  Chicago : Time, Inc., 1965   Document:  English :  Book      Libraries Worldwide : 3   More Like This:  Advanced options ...   See more details for locating this item","Life.  Publication:  Chicago : Time, Inc., 1965   Document:  English :  Book      Libraries Worldwide : 3   More Like This:  Advanced options ...   See more details for locating this item","Chicago : Time, Inc., 1965"For self and country : a true story /,"Eilert, Rick.","New York : W. Morrow, 1983""Riverine : a brown-water sailor in the Delta, 1967 /","Sheppard, Don.","New York : Pocket Books, 1985"The flotsam of war and peace : a study of the Vietnam veteran in American society /,"Fleming, Robert Howard.","1984 Dissertation:  Thesis (Ed. D.)--Boston University, 1979.""In the presence of mine enemies, 1965-1973 ; a prisoner of war /","Rutledge, Howard.","Boston : Hall,  1974, 1973"Tomorrow's my day off /,"Downs, Thomas R.","[Alexandria, VA : s.n., 1969"The whole thing was a lie!,"Duncan, Don, 1930-","[Nyack, N.Y., Fellowship Publications, 1966"The whole thing was a lie /,"Duncan, Don, 1930-","Chicago, Ill. : Students for a Democratic Society : Distributed by Veterans for Peace in Vietnam, 1966"The whole thing was a lie! /,"Duncan, Don, 1930-","N[ew] Y[ork], N.Y. : Religious Society of Friends, 1966""American heritage : August/September 1978, vol. 29, no. 5.  Publication:  New York : American Heritage Pub., 1978   Document:  English :  Book      Libraries Worldwide : 3   More Like This:  Advanced options ...   See more details for locating this item","American heritage : August/September 1978, vol. 29, no. 5.  Publication:  New York : American Heritage Pub., 1978   Document:  English :  Book      Libraries Worldwide : 3   More Like This:  Advanced options ...   See more details for locating this item","New York : American Heritage Pub., 1978""Twelve, twenty and five; a doctor's year in Vietnam.","Parrish, John Anthony.",New York E.P. Dutton 1972A rumor of war /,"Caputo, Philip.","New York : Holt, Rinehart and Winston, 1977""Rand Vietnam interview series TET-B refugees' reactions to Tet Offensive /  Publication:  [Santa Monica, Calif.] : The Corporation, 1972   Document:  English :  Book   :  Microform         Libraries Worldwide : 3   More Like This:  Advanced options ...   See more details for locating this item","Rand Vietnam interview series TET-B refugees' reactions to Tet Offensive /  Publication:  [Santa Monica, Calif.] : The Corporation, 1972   Document:  English :  Book   :  Microform         Libraries Worldwide : 3   More Like This:  Advanced options ...   See more details for locating this item","[Santa Monica, Calif.] : The Corporation, 1972"The History of 6RAR-NZ (ANZAC) Battalion /,"Johnson, L. D.; Dorizi, R. J.","Ennogera, Qld. : 6RAR-NZ (ANZAC) Battalion,  1972-""Viet Nam, the unheard voices /","Luce, Don.; Sommer, John.","Ithaca and London : Cornell Univ. Press, 1969"Rand Vietnam interview series XN effects of bombing of North Vietnam.    Corp,Rand Corporation.,"Alexandria, Va. : Defense and Documentation Center for Scientific and Technical Information, Cameron Station, 1972"Dispatches /,"Herr, Michael.","London : Pan Books, 1979"Dispatches /,"Herr, Michael, 1940-","London : Picador, 1979"Dispatches /,"Herr, Michael.","[Taipei : Loyal Book Co., 1977""Worthy daughters and sons of Lao people  Publication:  [Hanoi?] Neo Lao Haksat Publications, 1966   Document:  English :  Book   :  Microform         Libraries Worldwide : 3   More Like This:  Advanced options ...   See more details for locating this item","Worthy daughters and sons of Lao people  Publication:  [Hanoi?] Neo Lao Haksat Publications, 1966   Document:  English :  Book   :  Microform         Libraries Worldwide : 3   More Like This:  Advanced options ...   See more details for locating this item","[Hanoi?] Neo Lao Haksat Publications, 1966"Why is Canada in Vietnam? : the truth about our foreign aid.,"Culhane, Claire.","[S.l.] : NC Pr, CN, 1972"News from Wilfred Burchett : reality of the massacre policy.,"Burchett, Wilfred G., 1911-1983.","[Melbourne?] : Beacon publication, 1970"To bear any burden : the Vietnam War and its aftermath in the words of Americans and Southeast Asians /,"Santoli, Al, 1949-","New York : E.P. Dutton, 1985"News from Wilfred Burchett : reality of the massacre policy.,"Burchett, Wilfred G., 1911-1983.","[Melbourne?] : Beacon publication, 1970"To bear any burden : the Vietnam War and its aftermath in the words of Americans and Southeast Asians /,"Santoli, Al, 1949-","New York : E.P. Dutton, 1985"Everything we had : an oral history of the Vietnam War /,"Santoli, Al,","New York : Ballantine Books, 1981"Dear America : letters home from Vietnam /,"Edelman, Bernard,","New York : Pocket Books, 1985"Letters from Vietnam /,"Shepherd, Richard DeWitt Barlow, -1967.","[Princeton, N.J. : A.B. Shepherd], 1968"Vietnamese in Southern California /,"Hagerty, Elizabeth Ann.","San Diego : E.A. Hagerty, 1980   Dissertation:  Thesis (Ph. D.)--United States International University, 1980."Vietnamese in Southern California,"Hagerty, Elizabeth Ann.","1980 Dissertation:  Thesis (Ph. D.)--United States International University, 1980."The two shores of hell.,"Ray, Michle.","New York, D. McKay Co. 1967"Born on the Fourth of July.,"Kovic, Ron.",1976Born on the Fourth of July /,"Kovic, Ron.","New York : Pocket Books,  1980-1988?"Born on the Fourth of July,"Kovic, Ron, (1946- ...)., Auteur.","New York : Pocket Books, 1976"Born on the Fourth of July.,"Kovic, Ron.","Quality Paperback Book Club, 1976""Rand Vietnam interview series L Saigon residents' attitudes to the war /  Publication:  [Santa Monica, Calif.] : The Corporation, 1972   Document:  English :  Book   :  Microform         Libraries Worldwide : 3   More Like This:  Advanced options ...   See more details for locating this item","Rand Vietnam interview series L Saigon residents' attitudes to the war /  Publication:  [Santa Monica, Calif.] : The Corporation, 1972   Document:  English :  Book   :  Microform         Libraries Worldwide : 3   More Like This:  Advanced options ...   See more details for locating this item","[Santa Monica, Calif.] : The Corporation, 1972"Silence was a weapon : the war for the Vietnam village /,"Herrington, Stuart A., 1941-","Novato, CA : Presidio Press, 1982""Rand Vietnam interview series C reactions of Viet Cong to 1967 Tet talks /  Publication:  [Santa Monica, Calif.] : The Corporation, 1972   Document:  English :  Book   :  Microform         Libraries Worldwide : 3   More Like This:  Advanced options ...   See more details for locating this item","Rand Vietnam interview series C reactions of Viet Cong to 1967 Tet talks /  Publication:  [Santa Monica, Calif.] : The Corporation, 1972   Document:  English :  Book   :  Microform         Libraries Worldwide : 3   More Like This:  Advanced options ...   See more details for locating this item","[Santa Monica, Calif.] : The Corporation, 1972""Interview of Lt. Gen. Archie J. Old, Jr. /","Old, Archie J., 1906-; Ahmann, Hugh N.; Monday, Mary Ellen.","[Washington, D.C. : United States Air Force Historical Research Center : Office of Air Force History Headquarters, USAF, 1982"Rand Vietnam interview series GE experiences and expectations during Tet Offensive.    Corp,Rand Corporation.,"Alexandria, Va : Defense and Documentation Center for Scientific and Technical Information, Cameron Station, 1972"Fragments of war /,"Perkins, Jill.","[Hong Kong] : Chinese Christian Literature Council for Central Committee of the Fellowship of the Least Coin, Asian Church Women's Conference, 1970""Letters of 2nd Lt. Richard S. Johnson, Jr., U.S. Marine Corps.","Johnson, Richard S., 1943-1967.","Columbia, S.C. : Printed by R.L. Bryan Co., 1969"A Vietcong memoir /,"Truong,Nhu Tang.; Chanoff, David.; Doan, Van Toai,","New York : Vintage Books, 1985"Prior acts of consent : the biography of a Viet Nam veteran /,"Gottlob, Dian Marie.","1985 Dissertation:  Thesis (Ph. D.)--University of Iowa, 1985."Five women I love : Bob Hope's Vietnam story.,"Hope, Bob.","London : Robert Hale, 1966""Aces and aerial victories : the United States Air Force in Southeast Asia, victories, 1965-1973 /","Futrell, Robert Frank.; Eastman, James N., and others","[Maxwell Air Force Base, Ala.] : Air University, Albert F. Simpson Historical Research Center : For sale by the Supt. of Docs., U.S. Govt. Print. Off., 1976"Prisoners of war in Vietnam /,"Van Dyke, Jon M.","Ithaca, N.Y. : Glad Day Press,  1971, 1970""Letters from South Vietnam.  Publication:  Hanoi : Foreign Languages Pub. House, 1964   Document:  English :  Book      Libraries Worldwide : 2   More Like This:  Advanced options ...   See more details for locating this item","Letters from South Vietnam.  Publication:  Hanoi : Foreign Languages Pub. House, 1964   Document:  English :  Book      Libraries Worldwide : 2   More Like This:  Advanced options ...   See more details for locating this item","Hanoi : Foreign Languages Pub. House, 1964"Doing good /,"Balaban, John, 1943-","[S.l. : s.n., 1977""Interview of Major General Leroy W. Svendsen, Jr. /","Svendsen, Leroy W., 1928-; Scheiding, David O.; Davis, Faye.","[Washington, D.C. : United States Air Force Historical Research Center : Office of Air Force History Headquarters, USAF, 1985"The passing of the night : my seven years as a prisoner of the North Vietnamese /,"Risner, Robinson.","New York : Ballantine Books,  1983, 1973"Letters from Vietnam.,"Adler, Bill, ed.","New York : Parallax, 1966"Marine Corps operations in Vietnam : field interviews /,"Frank, Benis M.","[Washington, D.C. : Oral History Unit, History and Museums Division, 1975"Grandma wore combat boots; a look at the Viet-Nam War,"Brown, Nettie Cardoza.","[El Centro, Calif., El Centro Pub. Co., 1969"I'm no hero; a POW story.,"Plumb, Joseph Charles.","[Independence, Mo.] : Independence Press, 1973""Peace with honor? : an American reports on Vietnam, 1973-1975 /","Herrington, Stuart A., 1941-.","Novato, CA : Presidio Press, 1983""American heritage : April/May 1978, vol. 29, no. 3.  Publication:  New York : American Heritage Pub., 1978   Document:  English :  Book      Libraries Worldwide : 2   More Like This:  Advanced options ...   See more details for locating this item","American heritage : April/May 1978, vol. 29, no. 3.  Publication:  New York : American Heritage Pub., 1978   Document:  English :  Book      Libraries Worldwide : 2   More Like This:  Advanced options ...   See more details for locating this item","New York : American Heritage Pub., 1978""Cpl. Stephen J. Erchenbrecher collection, 1969-1975.","Erchenbrecher, Stephen J., 1951-",1969-1975Reconnecting time and history in narratives of the Vietnam War /,"Gaspar, Charles Jamieson.","1983 Dissertation:  Thesis (Ph. D.)--University of Connecticut, 1983."No other road to take,"Nguyen, Thi inh (1920-....). Auteur.","Ithaca, N.Y. : Cornell University, Dept. of Asian Studies, 1976"The Vietnam terror /,"Chu, Cong.","Wheat Ridge, Co. : Kipling Rally, 1984"The whole thing was a lie! /,"Duncan, Don, 1930-","[San Francisco? : Noah's Ark?,  1966, ?"Strange meeting /,"Ramsey, Douglas K.","[Los Angeles, Calif. : Occidental College, 1973"The whole thing was a lie! /,"Duncan, Don, 1930-","[San Francisco? : Noah's Ark?,  1966, ?"Strange meeting /,"Ramsey, Douglas K.","[Los Angeles, Calif. : Occidental College, 1973"GI revolts : the breakdown of the U.S. Army in Vietnam /,"Boyle, Richard.; Boyle, Richard.","San Francisco, Calif. : United Front Press, 1972"Pawns : a journey into Vietnam.,"Abbate, Steve.",1980A rumor of war /,"Caputo, Philip.","New York : Ballantine Books,  1978, 1977"A rumor of war /,"Caputo, Philip.","London : Arrow Books,  1979, 1978"You can see a lot standing under a flare in the Republic of Vietnam; my year at war.,"Hughes, Larry, 1944-","New York, Morrow,  1969, 1970""Senior officers oral history program : Melvin Zais, General, USA Retired.","Zais, Melvin, 1916-1981.; Golden, William L.; Rice, Richard C.","Carlisle Barracks, Pa. : U.S. Army War College, 1977"Interview of General Jacob E. Smart /,"Smart, Jacob E., 1909-2006.; McCants, Arthur W.; Hasdorff, James Curtis,","[Washington, D.C. : United States Air Force Historical Research Center : Office of Air Force History Headquarters, USAF, 1978""Letters from South Vietnam  Publication:  Hanoi : Foreign Languages Pub. House, 1963   Document:  English :  Book   :  Microform         Libraries Worldwide : 2   More Like This:  Advanced options ...   See more details for locating this item","Letters from South Vietnam  Publication:  Hanoi : Foreign Languages Pub. House, 1963   Document:  English :  Book   :  Microform         Libraries Worldwide : 2   More Like This:  Advanced options ...   See more details for locating this item","Hanoi : Foreign Languages Pub. House, 1963"Bloody one /,"Edwards, Roger.","Billings, MT : R.E. Books, 1982"Hammer and rifle. Tome I.,"Le, Nguyen.","Hanoi : Editorial Board of the Vietnamese Trade Unions, Vietnam Federation of Trade Unions, 1966"Debrief report /,"Jordan, C. E.","[Vietnam : s.n.], 1968"Eleven bravo edict /,"Fiasconaro, George P.","[United States : G.P. Fiasconaro], 1977"Bong sai! /,"Conroy, Michael R.","[S.l. : s.n., 1975"On the other side of the war /,"Webb, Kate, 1943-2007.","[S.l.?] : United Press International, 1971"The History of the Vietnam War. /,"Welsh, Douglas.","NY : Exeter Bks., 1981"[Interview with Larry Wright for the Flint Hills Oral History Project /,"Wright, Larry, 1938-; Sherman, Peggy.",1982Five years to freedom /,"Rowe, James N.","Boston : Little, 1971"Air war over Vietnam : [an incisive documentary report by the airmen who flew against the North Vietnamese] /,"Braybrook, Roy.","Canoga Park, Calif. : Challenge Pub., 1984"--and a hard rain fell : a GI's true story of the war in Vietnam /,"Ketwig, John.","New York : Pocket Books, 1985"... and a hard rain fell : a GI's true story of the war in Vietnam /,"Ketwig, John.","New York : Macmillan ; London : Collier Macmillan, 1985"Scars and stripes : the true story of one man's courage in facing death as a Vietnam POW /,"McDaniel, Eugene B.; Johnson, James Leonard,","[S.l. : s.n.,  1975-1991?"The killing zone : my life in the Vietnam War /,"Downs, Frederick.","Berkley, 1978""Journal of a plague year : 12, 20 & 5.","Parrish, John Anthony.","New York : Dutton, 1973"Vietnamese in southern California /,"Hagerty, Elizabeth Ann.","1980   Dissertation:  Thesis (Ph. D.)--United States International University, 1980."Reflections of a Colonel of the North Vietnamese Army ...,Tran-van-Dac.,"[Saigon] JUSPAO, Field Development Division 1968"The two shores of hell /,"Ray, Michle.","London : Murray, 1968""The enclave some U.S. military efforts in Ly Tin District, Quang Tin Province 1966-1968","West, Francis J.","Santa Monica, Calif. : Rand Corp., 1969"They wouldn't let us die. The prisoners of war tell their story.,"Rowan, Stephen A., 1928-","Middle Village, N. Y., J. David  1974, 1973""12, 20 & 5 : a doctor's year in Vietnam /","Parrish, John A.","New York : E.P. Dutton, 1972"Prodigal father : a fighter pilot finds peace in the wake of his destruction /,"Bottomly, Heath.","Glendale, Calif. : G/L Regal Books, 1975"Everything we had : an oral history of the Vietnam War by thirty-three American soldiers who fought it /,"Santoli, Al,","New York : Ballantine Books, 1981"A soldier reports.,"Westmoreland, William C. 1914-2005.","Dell, 1976"A soldier reports /,"Westmoreland, William C. 1914-2005.","Garden City, N.Y. : Doubleday, 1976""Vietnam : a photographic essay of the undeclared war in Southeast Asia.  Publication:  [S.l. : Brooklyn Museum, 1972   Document:  English :  Book      Libraries Worldwide : 2   More Like This:  Advanced options ...   See more details for locating this item","Vietnam : a photographic essay of the undeclared war in Southeast Asia.  Publication:  [S.l. : Brooklyn Museum, 1972   Document:  English :  Book      Libraries Worldwide : 2   More Like This:  Advanced options ...   See more details for locating this item","[S.l. : Brooklyn Museum, 1972"A soldier reports /,"Westmoreland, William C. 1914-2005.","Garden City, N.Y. : Doubleday, 1976""Interview of Major General Malcolm E. Ryan, Jr. /","Ryan, Malcolm E., 1927-; Edwards, Charles R.; Davis, Faye.","[Washington, D.C. : United States Air Force Historical Research Center : Office of Air Force History Headquarters, USAF, 1984"Two of the missing : a reminiscence of some friends in the war /,"Young, Perry Deane.","New York : Coward, McCann & Geoghegan, 1975""Analysis of operational criteria and user requirements of a naval air reporting system.  Publication:  Dunn Loring, Va. : Historical Evaluation and Research Organization, 1974   Document:  English :  Book      Libraries Worldwide : 2   More Like This:  Advanced options ...   See more details for locating this item","Analysis of operational criteria and user requirements of a naval air reporting system.  Publication:  Dunn Loring, Va. : Historical Evaluation and Research Organization, 1974   Document:  English :  Book      Libraries Worldwide : 2   More Like This:  Advanced options ...   See more details for locating this item","Dunn Loring, Va. : Historical Evaluation and Research Organization, 1974""Analysis of operational criteria and user requirements of a naval air reporting system.  Publication:  Dunn Loring, Va. : Historical Evaluation and Research Organization, 1974   Document:  English :  Book      Libraries Worldwide : 2   More Like This:  Advanced options ...   See more details for locating this item","Analysis of operational criteria and user requirements of a naval air reporting system.  Publication:  Dunn Loring, Va. : Historical Evaluation and Research Organization, 1974   Document:  English :  Book      Libraries Worldwide : 2   More Like This:  Advanced options ...   See more details for locating this item","Dunn Loring, Va. : Historical Evaluation and Research Organization, 1974"Interview of Maj. Gen. James H. Watkins /,"Watkins, James H., 1919-; Lovelace, Cary A.; Monday, Mary Ellen.","[Washington, D.C. : United States Air Force Historical Research Center : Office of Air Force History Headquarters, USAF, 1984"Interview of Lt. Gen. Joseph H. Moore /,"Moore, Joseph H., 1914-; Cleary, Mark C.; Scott, Beth F.","[Washington, D.C. : United States Air Force Historical Research Center : Office of Air Force History Headquarters, USAF, 1984""G.I.'s in Vietnam say: ""get the hell out!"" An interview with an American air commando who spent two years in Vietnam and, along with 12 buddies, was court-martialed for refusing to fight the liberation army.  Publication:  [New York, Challenge-Desafio,  1965, ?   Document:  English :  Book      Libraries Worldwide : 2   More Like This:  Advanced options ...   See more details for locating this item","G.I.'s in Vietnam say: ""get the hell out!"" An interview with an American air commando who spent two years in Vietnam and, along with 12 buddies, was court-martialed for refusing to fight the liberation army.  Publication:  [New York, Challenge-Desafio,  1965, ?   Document:  English :  Book      Libraries Worldwide : 2   More Like This:  Advanced options ...   See more details for locating this item","[New York, Challenge-Desafio,  1965, ?"Once a warrior king : memories of an officer in Vietnam /,"Donovan, David.","New York : McGraw-Hill, 1985"The thousand-yard stare a socio-cultural interpretation of Vietnam war narratives /,"Lewis, Lloyd B.","1983, 1982 Dissertation:  Thesis (Ph. D.)--University of Maryland, 1982."Once a warrior king : memories of a officer in Vietnam /,"Donovan, David.","New York : McGraw-Hill, 1985""Oral history interview with General Louis T. Seith, 27-28 October 1980 /","Seith, Louis T.; McCants, Arthur W.,; Monday, Mary Ellen.","[Maxwell Air Force Base, Ala. : United States Air Force Historical Research Agency : Office of Air Force History Headquarters, USAF, 1980""12, 20? a doctor's year in Vietnam","Parrish, John A. 1939-","New York, E.P. Dutton, 1972"Vietnam vignettes /,"Blackwell, Bob.","[Milwaukee : Milwaukee Sentinel,  1965, ?"The unheard voices /,"Luce, Don.; Sommer, John.","Ithaca, N.Y. : Cornell University Press, 1967"When hell was in session /,"Denton, Jeremiah A.; Brandt, Ed.","Lake Wylie, S.C. : R.E. Hopper & Associates, 1982"Strong at the broken places : a personal story /,"Cleland, Max, 1942-","[Marietta, Ga.] : Cherokee Publishing Co., 1980"Beyond combat /,"Hutchens, James M.","Chicago : Moody Press,  1970, 1968"Ten Vietnamese.,"Sheehan, Susan.","New York : Knopf, 1967"Vietnam : what a soldier gives /,"Hartline, David L.","Lyerly, Ga. : Elite Forces Pub., 1984""Phantom over Vietnam : fighter pilot, USMC /","Trotti, John, 1936-","New York : Berkley Books,  1985, 1984"I'm no hero : a POW story as told to Glen DeWerff /,"Plumb, Charlie.; DeWerff, Glen.","Mechanicsburg, PA : Executive Books, 1973"Ranger's diary : Viet-nam.,"Stewart, Harry C., 1935-","[S.l. : s.n., 1980s"In love and war : the story of a family's ordeal and sacrifice during the Vietnam years /,"Stockdale, James B.; Stockdale, Sybil.","New York : Bantam, 1984"In love and war : the story of a family's ordeal and sacrifice during the Vietnam years /,"Stockdale, James B.; Stockdale, Sybil.","New York : Bantam, 1984"Winter soldier investigation.    Corp,Vietnam Veterans Against the War.,"Boston: Beacon Press., 1972"Senior officer debriefing report : [R. Wetherill].,"Wetherill, Roderick, 1918-1978.","[APO San Francisco 96215?] : Headquarters, Delta Military Assistance Command, USAAG, IV CTZ, 1970"The new legions.,"Duncan, Donald.","New York, 1967""Senior officer debriefing report, Major General Howard H. Cooksey /","Cooksey, Howard H.","APO San Francisco 96349 : Headquarters, First Regional Assistance Command, 1973"Senior officer debriefing report : [BG H.R. Parfitt] /,"Parfitt, H. R.","APO San Francisco 96375 : Dept. of the Army, Headquarters, U.S. Army Vietnam, 1969"The undaunted heroes : a Vietnam diary /,"Vysotsky, Sergei.; Glazunov, Ilia Sergeevich.","Moscow : Progress Pub., 1972""Personnel situation in the 1st Battalion, 48th Regiment, 10th Infantry Division, Republic of Vietnam Armed Forces /","Black, Gorham L., III., CPT.",1968Senior officer debriefing program /,"Richards, Darrie H.","APO 96238 : HQ, United States Army Support Command, Qui Nhon, 1969""Interview, ca. 1985.","Allen, Lee, 1938-; Bell, Mark D.",1985Debriefing report /,"Burdett, Allen M.","APO San Francisco 96384 : Dept. of the Army, Headquarters, 1st Aviation Brigade, 1970"Interview of Brig. Gen. Cleo M. Bishop /,"Bishop, Cleo M., 1917-; Dick, John N.","[Washington, D.C. : Albert F. Simpson Historical Research Center : Office of Air Force History Headquarters, USAF, 1976"The man who changed sides,"Nguyn, Van Ph. Auteur.","[Bangkok : South-East Asia Treaty Organization, 1972""Operations of the III Corps Ranger Group (ARVN), in a search & destroy mission (Operation Toledo) while OPCON to the 173rd Airborne Brigade, on 14 August-1 September 1966, in Long Khan, Phuoc Tuy Province, Republic of Vietnam /","Thomas, John K.","Fort Benning, GA. : Staff Department, The Infantry School, 1968""Senior officer debriefing report, 11th ACR, 7 Dec 69 to 7 June 70 : [Donn A. Starry] /","Starry, Donn A. 1925-2011.","[APO San Francisco? : s.n.], 1970""Diary of an infiltrator.  Publication:  Saigon : United States Mission in Vietnam, 1966   Document:  English :  Book      Libraries Worldwide : 1   More Like This:  Advanced options ...   See more details for locating this item","Diary of an infiltrator.  Publication:  Saigon : United States Mission in Vietnam, 1966   Document:  English :  Book      Libraries Worldwide : 1   More Like This:  Advanced options ...   See more details for locating this item","Saigon : United States Mission in Vietnam, 1966"